datasetKey,title,modified,publisher,doi
9ff7d317-609b-4c08-bd86-3bc404b77c42,Manual of the Alien Plants of Belgium,2018-10-03T14:25:07.022+0000,a344ee9f-f1b7-4761-be2c-58ee6d741395,10.15468/wtda1m
289244ee-e1c1-49aa-b2d7-d379391ce265,"Inventory of alien macroinvertebrates in Flanders, Belgium",2018-10-03T14:25:07.949+0000,05c249d0-dfa0-11d8-b22e-b8a03c50a862,10.15468/yxcq07
98940a79-2bf1-46e6-afd6-ba2e85a26f9f,"Checklist of non-native freshwater fishes in Flanders, Belgium",2018-10-03T14:25:07.565+0000,1cd669d0-80ea-11de-a9d0-f1765f95f18b,10.15468/xvuzfh
b043c480-dd36-4f4f-aa82-e188753ff09d,Catalogue of the Rust Fungi of Belgium,2018-04-26T14:18:09.550+0000,a344ee9f-f1b7-4761-be2c-58ee6d741395,10.15468/2dboyn
1f3505cd-5d98-4e23-bd3b-ffe59d05d7c2,Ad hoc checklist of alien species in Belgium,2018-10-03T14:25:07.467+0000,1cd669d0-80ea-11de-a9d0-f1765f95f18b,10.15468/3pmlxs
1738f272-6b5d-4f43-9a92-453a8c5ea50a,RINSE - Pathways and vectors of biological invasions in Northwest Europe,2018-10-03T14:25:08.873+0000,1cd669d0-80ea-11de-a9d0-f1765f95f18b,10.15468/guejza
3f5e930b-52a5-461d-87ec-26ecd66f14a3,"RINSE - Registry of non-native species in the Two Seas region countries (Great Britain, France, Belgium and the Netherlands)",2018-10-03T14:25:08.610+0000,1cd669d0-80ea-11de-a9d0-f1765f95f18b,10.15468/focajn
