locationId	locality	country	status	first_observed	last_observed	establishmentMeans	source	verification_key	checklist_datasetKey
ISO_3166-2:BE-VLG	Flemish Region	BE	PRESENT	2e3	2016	INTRODUCED	Vercauteren T, De Smedt S, Warmoes T, Goddeeris B, Wouters K (2005) Drie nieuwe Ponto-Kaspische inwijkelingen dringen door tot in kanalen in de provincie Antwerpen: de zoetwaterpolychaet Hypania invalida (Grube, 1860) en, voor het eerst in België, de platworm Dendrocoelum romanodanubiale (Codreanu, 1949) en de Donaupissebed Jaera istri Veuille, 1979. In: Nieuwborg H (ed), Natuurstudie in de provincie Antwerpen. Antwerpse Koepel voor Natuurstudie (ANKONA) Jaarboek 2003, pp 83–97	5199161	289244ee-e1c1-49aa-b2d7-d379391ce265
ISO_3166-2:BE-VLG	Flemish Region	BE	PRESENT	2002	2016	INTRODUCED	Soors J, van Haaren T, Timm T, Speybroeck J (2013) Bratislavia dadayi (Michaelsen, 1905) (Annelida: Clitellata: Naididae): a new non-indigenous species for Europe, and other non-native annelids in the Schelde estuary. Aquatic Invasions 8: 37–44, https://doi.org/10.3391/ai.2013.8.1.04	9442679	289244ee-e1c1-49aa-b2d7-d379391ce265
ISO_3166-2:BE-VLG	Flemish Region	BE	PRESENT	2010	2016	INTRODUCED	Soors J, van Haaren T, Timm T, Speybroeck J (2013) Bratislavia dadayi (Michaelsen, 1905) (Annelida: Clitellata: Naididae): a new non-indigenous species for Europe, and other non-native annelids in the Schelde estuary. Aquatic Invasions 8: 37–44, https://doi.org/10.3391/ai.2013.8.1.04	4812260	289244ee-e1c1-49aa-b2d7-d379391ce265
ISO_3166-2:BE-VLG	Flemish Region	BE	PRESENT	1996	2016	INTRODUCED	Seys J, Vincx M, Meire P (1999) Spatial distribution of oligochaetes (Clitellata) in the tidal freshwater and brackish parts of the Schelde estuary (Belgium). In: Aquatic Oligochaetes, Springer Netherlands, pp 119–132	4410088	289244ee-e1c1-49aa-b2d7-d379391ce265
ISO_3166-2:BE-VLG	Flemish Region	BE	PRESENT	1931	2016	INTRODUCED	Damas H (1938) Sur la presence dans la Meuse belge de Branchiura sowerbyi, Craspedacusta sowerbyi, et Urnatella gracilis. Annalles de Societé Zoologique Belge 69: 293–310	2308574	289244ee-e1c1-49aa-b2d7-d379391ce265
ISO_3166-2:BE-VLG	Flemish Region	BE	PRESENT	2009	2016	INTRODUCED	Soors J, van Haaren T, Timm T, Speybroeck J (2013) Bratislavia dadayi (Michaelsen, 1905) (Annelida: Clitellata: Naididae): a new non-indigenous species for Europe, and other non-native annelids in the Schelde estuary. Aquatic Invasions 8: 37–44, https://doi.org/10.3391/ai.2013.8.1.04	2308605	289244ee-e1c1-49aa-b2d7-d379391ce265
ISO_3166-2:BE-VLG	Flemish Region	BE	PRESENT	2006	2016	INTRODUCED	Soors J, van Haaren T, Timm T, Speybroeck J (2013) Bratislavia dadayi (Michaelsen, 1905) (Annelida: Clitellata: Naididae): a new non-indigenous species for Europe, and other non-native annelids in the Schelde estuary. Aquatic Invasions 8: 37–44, https://doi.org/10.3391/ai.2013.8.1.04	9479629	289244ee-e1c1-49aa-b2d7-d379391ce265
ISO_3166-2:BE-VLG	Flemish Region	BE	PRESENT	2008	2016	INTRODUCED	Soors J, van Haaren T, Timm T, Speybroeck J (2013) Bratislavia dadayi (Michaelsen, 1905) (Annelida: Clitellata: Naididae): a new non-indigenous species for Europe, and other non-native annelids in the Schelde estuary. Aquatic Invasions 8: 37–44, https://doi.org/10.3391/ai.2013.8.1.04	4410056	289244ee-e1c1-49aa-b2d7-d379391ce265
ISO_3166-2:BE-VLG	Flemish Region	BE	PRESENT	2009	2016	INTRODUCED	Soors J, van Haaren T, Timm T, Speybroeck J (2013) Bratislavia dadayi (Michaelsen, 1905) (Annelida: Clitellata: Naididae): a new non-indigenous species for Europe, and other non-native annelids in the Schelde estuary. Aquatic Invasions 8: 37–44, https://doi.org/10.3391/ai.2013.8.1.04	2308541	289244ee-e1c1-49aa-b2d7-d379391ce265
ISO_3166-2:BE-VLG	Flemish Region	BE	PRESENT	2002	2016	INTRODUCED	Soors J, van Haaren T, Timm T, Speybroeck J (2013) Bratislavia dadayi (Michaelsen, 1905) (Annelida: Clitellata: Naididae): a new non-indigenous species for Europe, and other non-native annelids in the Schelde estuary. Aquatic Invasions 8: 37–44, https://doi.org/10.3391/ai.2013.8.1.04	4410150	289244ee-e1c1-49aa-b2d7-d379391ce265
ISO_3166-2:BE-VLG	Flemish Region	BE	PRESENT	1995	2016	INTRODUCED	Ysebaert T, Meire P, De Block M, De Regge N, Soors J (1997) A first record of Marenzelleria viridis (Verril, 1873) (Polychaeta, Spionidae) in the Schelde estuary (Belgium). Biologisch Jaarboek (Dodonaea) 64: 176–181	2321012	289244ee-e1c1-49aa-b2d7-d379391ce265
ISO_3166-2:BE-VLG	Flemish Region	BE	PRESENT	2008	2016	INTRODUCED	Soors J, van Haaren T, Timm T, Speybroeck J (2013) Bratislavia dadayi (Michaelsen, 1905) (Annelida: Clitellata: Naididae): a new non-indigenous species for Europe, and other non-native annelids in the Schelde estuary. Aquatic Invasions 8: 37–44, https://doi.org/10.3391/ai.2013.8.1.04	2321010	289244ee-e1c1-49aa-b2d7-d379391ce265
ISO_3166-2:BE-VLG	Flemish Region	BE	PRESENT	1950	2016	INTRODUCED	Leloup E, Lefevere S (1952) Sur la présence dans les eaux de la côte belge du cirripède, Elminius modestus Darwin, 1854, du copepode parasite, Mytilicola intestinalis Steuer, 1902, et du polychète, Mercierella enigmatica Fauvel, 1922. Mededelingen Koninklijk Belgisch Instituut voor Natuur Wetenschappen 28: 1–12	2327735	289244ee-e1c1-49aa-b2d7-d379391ce265
ISO_3166-2:BE-VLG	Flemish Region	BE	PRESENT	2014	2016	INTRODUCED	Boets P, Brosens D, Lock K, Adriaens T, Aelterman B, Mertens J & Goethals P. 2016. Alien macroinvertebrates in Flanders (Belgium). Aquatic Invasions 11 (2): 131–144. https://doi.org/10.3391/ai.2016.11.2.03	7009279	289244ee-e1c1-49aa-b2d7-d379391ce265
ISO_3166-2:BE-VLG	Flemish Region	BE	PRESENT	2001	2016	INTRODUCED	Vercauteren T, De Smedt S, Warmoes T, Goddeeris B, Wouters K (2005) Drie nieuwe Ponto-Kaspische inwijkelingen dringen door tot in kanalen in de provincie Antwerpen: de zoetwaterpolychaet Hypania invalida (Grube, 1860) en, voor het eerst in België, de platworm Dendrocoelum romanodanubiale (Codreanu, 1949) en de Donaupissebed Jaera istri Veuille, 1979. In: Nieuwborg H (ed), Natuurstudie in de provincie Antwerpen. Antwerpse Koepel voor Natuurstudie (ANKONA) Jaarboek 2003, pp 83–97	4344674	289244ee-e1c1-49aa-b2d7-d379391ce265
ISO_3166-2:BE-VLG	Flemish Region	BE	PRESENT	1987	2016	INTRODUCED	Kerckhof F, Dumoulin E (1987) Eerste vondsten van de Amerikaanse zwaardschede Ensis directus (Conrad, 1843) langs de Belgische kust. De Strandvlo 7: 51–52	2287249	289244ee-e1c1-49aa-b2d7-d379391ce265
ISO_3166-2:BE-VLG	Flemish Region	BE	PRESENT	1924	2016	INTRODUCED	Adam W (1947) Revision des Mollusques de la Belgique. I Mollusques terrestres et dulcicoles. Mémoires du Musée Royal d’Histoire Naturelle de Belgique, 106, 297 pp	5777912	289244ee-e1c1-49aa-b2d7-d379391ce265
ISO_3166-2:BE-VLG	Flemish Region	BE	PRESENT	1927	2016	INTRODUCED	Adam W (1947) Revision des Mollusques de la Belgique. I Mollusques terrestres et dulcicoles. Mémoires du Musée Royal d’Histoire Naturelle de Belgique, 106, 297 pp	5192470	289244ee-e1c1-49aa-b2d7-d379391ce265
ISO_3166-2:BE-VLG	Flemish Region	BE	PRESENT	1911	2016	INTRODUCED	Adam W, Leloup E (1934) Sur la présence du gastéropode Crepidula fornicata (Linné, 1758) sur la côte belge. Bulletin du Musée royal d'Histoire naturelle de Belgique 10: 1–5	5192789	289244ee-e1c1-49aa-b2d7-d379391ce265
ISO_3166-2:BE-VLG	Flemish Region	BE	PRESENT	1700	2016	INTRODUCED	Kerckhof F, Haelters J, Gollasch S (2007) Alien species in the marine and brackish ecosystem: the situation in Belgian waters. Aquatic Invasions 2: 243–257, https://doi.org/10.3391/ai.2007.2.3.9	7791733	289244ee-e1c1-49aa-b2d7-d379391ce265
ISO_3166-2:BE-VLG	Flemish Region	BE	PRESENT	1730	1732	INTRODUCED	Sellius G (1733) Historia naturalis teredinis seu xylophagi marini tubulochonchoidis speciatim Belgici, Trajecti ad Rhenum, p 366	2288847	289244ee-e1c1-49aa-b2d7-d379391ce265
ISO_3166-2:BE-VLG	Flemish Region	BE	PRESENT	1600	2016	INTRODUCED	Backeljau T (1986) Lijst van de recente mariene mollusken van België. Studiedocumenten van het K.B.I.N. 29. Koninklijk Belgisch Instituut voor Natuurwetenschappen: Brussel, 106 pp	2288859	289244ee-e1c1-49aa-b2d7-d379391ce265
ISO_3166-2:BE-VLG	Flemish Region	BE	PRESENT	1999	2016	INTRODUCED	Keppens M, Mienis HK (2004) A propos de la présence de Sinanodonta woodiana (Lea, 1834) en Belgique. Novapex Société 5: 78–81	4559541	289244ee-e1c1-49aa-b2d7-d379391ce265
ISO_3166-2:BE-VLG	Flemish Region	BE	PRESENT	1992	2016	INTRODUCED	Swinnen F, Leynen M, Sablon R, Duvivier L, Vanmaele R (1998) The Asiatic clam Corbicula (Bivalvia: Corbiculidae) in Belgium. Biologie 68: 47–53	8190231	289244ee-e1c1-49aa-b2d7-d379391ce265
ISO_3166-2:BE-VLG	Flemish Region	BE	PRESENT	1992	2016	INTRODUCED	Swinnen F, Leynen M, Sablon R, Duvivier L, Vanmaele R (1998) The Asiatic clam Corbicula (Bivalvia: Corbiculidae) in Belgium. Biologie 68: 47–53	5189032	289244ee-e1c1-49aa-b2d7-d379391ce265
ISO_3166-2:BE-VLG	Flemish Region	BE	PRESENT	1835	2016	INTRODUCED	Nyst HJP (1835) Mollusques. Bulletin des Academies Royal des Sciences Lettres et Beaux Arts 2: 235–236 | Adam W (1947) Revision des Mollusques de la Belgique. I Mollusques terrestres et dulcicoles. Mémoires du Musée Royal d’Histoire Naturelle de Belgique, 106, 297 pp	2287076	289244ee-e1c1-49aa-b2d7-d379391ce265
ISO_3166-2:BE-VLG	Flemish Region	BE	PRESENT	1834	2016	INTRODUCED	Adam W (1947) Revision des Mollusques de la Belgique. I Mollusques terrestres et dulcicoles. Mémoires du Musée Royal d’Histoire Naturelle de Belgique, 106, 297 pp	2287072	289244ee-e1c1-49aa-b2d7-d379391ce265
ISO_3166-2:BE-VLG	Flemish Region	BE	PRESENT	1933	2016	INTRODUCED	Vandepitte L, De Poorter D, Lescrauweart A-N, Fockedey N, Mees J (2012) Niet-inheemse soorten van het Belgisch deel van de Noordzee en aanpalende estuaria. VLIZ Special publication 59. Vlaams Instituut voor de Zee (VLIZ): Oostende België, 372 pp	2287668	289244ee-e1c1-49aa-b2d7-d379391ce265
ISO_3166-2:BE-VLG	Flemish Region	BE	PRESENT	1899	2016	INTRODUCED	Loppens K (1902) Petricola pholadiformis L. Annales de la Société Royale Zoologique et Malacologique de Belgique 37: 41–42	2287615	289244ee-e1c1-49aa-b2d7-d379391ce265
ISO_3166-2:BE-VLG	Flemish Region	BE	PRESENT	2004	2016	INTRODUCED	Verween A, Kerckhof F, Vincx M, Degraer S (2006) First European record of the invasive brackish water clam Rangia cuneata (G.W. Sowerby I, 1831) (Mollusca: Bivalvia). Aquatic Invasions 1: 198–203, https://doi.org/10.3391/ai.2006.1.4.1	5188971	289244ee-e1c1-49aa-b2d7-d379391ce265
ISO_3166-2:BE-VLG	Flemish Region	BE	PRESENT	1869	2016	INTRODUCED	Adam W (1947) Revision des Mollusques de la Belgique. I Mollusques terrestres et dulcicoles. Mémoires du Musée Royal d’Histoire Naturelle de Belgique, 106, 297 pp	5189806	289244ee-e1c1-49aa-b2d7-d379391ce265
ISO_3166-2:BE-VLG	Flemish Region	BE	PRESENT	1998	2016	INTRODUCED	Sablon R, Vercauteren T, Lammens S, Ghyselbrecht E (2010a) Freshwater Molluscs introduced in Belgium in the last two Decades – Abstracts of the World Congress of Malacology, Phuket, Thailand, 18–24 July 2010, p 353	5189713	289244ee-e1c1-49aa-b2d7-d379391ce265
ISO_3166-2:BE-VLG	Flemish Region	BE	PRESENT	2005	2016	INTRODUCED	Lock K, Van Wichelen J, Packet J, Simoens I, Van Looy K, Louette G, Warmoes T, Denys L (2007) Bepalen van het maximaal en het goed ecologisch potentieel, alsook de huidige toestand, voor een aantal Vlaamse (gewestelijke) waterlichamen die vergelijkbaar zijn met de categorie meren - Deel I. Report Institute of Nature Conservation 2007/51, Brussels	2220347	289244ee-e1c1-49aa-b2d7-d379391ce265
ISO_3166-2:BE-VLG	Flemish Region	BE	PRESENT	1999	2016	INTRODUCED	Verslycke T, Janssen C, Lock K, Mees J (2000) First occurrence of the Pontocaspian invader Hemimysis anomala (Sars, 1907) in Belgium (Crustacea: Mysidacea). Belgian Journal of Zoology 130: 157–158	2220312	289244ee-e1c1-49aa-b2d7-d379391ce265
ISO_3166-2:BE-VLG	Flemish Region	BE	PRESENT	2e3	2016	INTRODUCED	Messiaen M, Lock K, Gabriels W, Vercauteren T, Wouters K, Boets P, Goethals PLM (2010) Alien macrocrustaceans in freshwater ecosystems in the eastern part of Flanders (Belgium). Belgian Journal of Zoology 140: 30–39	5177089	289244ee-e1c1-49aa-b2d7-d379391ce265
ISO_3166-2:BE-VLG	Flemish Region	BE	PRESENT	2005	2016	INTRODUCED	Soors J, Faasse M, Stevens M, Verbessem I, De Regge N, Van den Bergh E (2010) New crustacean invaders in the Schelde estuary (Belgium). Belgian Journal of Zoology 140: 3–10	2204831	289244ee-e1c1-49aa-b2d7-d379391ce265
ISO_3166-2:BE-VLG	Flemish Region	BE	PRESENT	1945	2016	INTRODUCED	Collection RBINS	2206086	289244ee-e1c1-49aa-b2d7-d379391ce265
ISO_3166-2:BE-VLG	Flemish Region	BE	PRESENT	1998	2016	INTRODUCED	Boets et al. unpublished data	2205951	289244ee-e1c1-49aa-b2d7-d379391ce265
ISO_3166-2:BE-VLG	Flemish Region	BE	PRESENT	1950	2016	INTRODUCED	Leloup E, Lefevere S (1952) Sur la présence dans les eaux de la côte belge du cirripède, Elminius modestus Darwin, 1854, du copepode parasite, Mytilicola intestinalis Steuer, 1902, et du polychète, Mercierella enigmatica Fauvel, 1922. Mededelingen Koninklijk Belgisch Instituut voor Natuur Wetenschappen 28: 1–12	2115769	289244ee-e1c1-49aa-b2d7-d379391ce265
ISO_3166-2:BE-VLG	Flemish Region	BE	PRESENT	1997	2016	INTRODUCED	Kerckhof F, Cattrijsse A (2001) Exotic Cirripedia (Balanomorpha) from buoys off the Belgian coast. Senckenbergiana maritime 31: 245–254, https://doi.org/10.1007/BF03043033	6128436	289244ee-e1c1-49aa-b2d7-d379391ce265
ISO_3166-2:BE-VLG	Flemish Region	BE	PRESENT	1700	2016	INTRODUCED	Kerckhof F, Cattrijsse A (2001) Exotic Cirripedia (Balanomorpha) from buoys off the Belgian coast. Senckenbergiana maritime 31: 245–254, https://doi.org/10.1007/BF03043033	6467647	289244ee-e1c1-49aa-b2d7-d379391ce265
ISO_3166-2:BE-VLG	Flemish Region	BE	PRESENT	1952	2016	INTRODUCED	Kerckhof F, Cattrijsse A (2001) Exotic Cirripedia (Balanomorpha) from buoys off the Belgian coast. Senckenbergiana maritime 31: 245–254, https://doi.org/10.1007/BF03043033	4805564	289244ee-e1c1-49aa-b2d7-d379391ce265
ISO_3166-2:BE-VLG	Flemish Region	BE	PRESENT	1997	2016	INTRODUCED	Kerckhof F, Cattrijsse A (2001) Exotic Cirripedia (Balanomorpha) from buoys off the Belgian coast. Senckenbergiana maritime 31: 245–254, https://doi.org/10.1007/BF03043033	5166489	289244ee-e1c1-49aa-b2d7-d379391ce265
ISO_3166-2:BE-VLG	Flemish Region	BE	PRESENT	1996	2016	INTRODUCED	Faasse M, Van Moorsel G (2003) The North-American amphipods, Melita nitida Smith, 1873 and Incisocalliope aestuarius (Watling and Maurer, 1973) (Crustacea: Amphipoda: Gammaridea), introduced to the western Scheldt estuary (The Netherlands). Aquatic Ecology 37: 13–22, https://doi.org/10.1023/A:1022120729031	2215949	289244ee-e1c1-49aa-b2d7-d379391ce265
ISO_3166-2:BE-VLG	Flemish Region	BE	PRESENT	1927	2016	INTRODUCED	Wouters K (2002) On the distribution of alien non-marine and estuarine macro-crustaceans in Belgium. Bulletin van het Koninklijk Belgisch Instituut voor Natuurwetenschappen, Biologie 72: 119–129	2218567	289244ee-e1c1-49aa-b2d7-d379391ce265
ISO_3166-2:BE-VLG	Flemish Region	BE	PRESENT	1992	2016	INTRODUCED	Wouters K (2002) On the distribution of alien non-marine and estuarine macro-crustaceans in Belgium. Bulletin van het Koninklijk Belgisch Instituut voor Natuurwetenschappen, Biologie 72: 119–129	2217982	289244ee-e1c1-49aa-b2d7-d379391ce265
ISO_3166-2:BE-VLG	Flemish Region	BE	PRESENT	2003	2016	INTRODUCED	Boets P, Lock K, Goethals PLM (2010b) First record of Synurella ambulans (Müller 1846) (Amphipoda: Crangonictidae) in Belgium. Belgian Journal of Zoology 140: 244–245	4416920	289244ee-e1c1-49aa-b2d7-d379391ce265
ISO_3166-2:BE-VLG	Flemish Region	BE	PRESENT	1990	2016	INTRODUCED	Vercauteren T, Sablon S, Wouters K (2006) Exotische ongewervelden in vijvers en grachten van het Provinciaal Groendomein ‘Prinsenpark’. In: Retie: een eerste bilan. In: Nieuwborg H, Rijvers T (eds), Natuurstudie in de provincie Antwerpen. Antwerpse Koepel voor Natuurstudie (ANKONA) Jaarboek 2004–2005, pp 27–39	4314683	289244ee-e1c1-49aa-b2d7-d379391ce265
ISO_3166-2:BE-VLG	Flemish Region	BE	PRESENT	1993	2016	INTRODUCED	Dewicke A (2002) Hyperbenthic communities of the North Sea. PhD Thesis. Universiteit Gent (RUG): Gent, 219 pp Dumortier M, De Bruyn L, Hens M, Peymen J, Schneiders A, Van Daele T, Van Reeth W (2007) Biodiversity Indicators 2007. State of Nature in Flanders (Belgium). Research Institute for Nature and Forest, Brussels, Belgium	4314702	289244ee-e1c1-49aa-b2d7-d379391ce265
ISO_3166-2:BE-VLG	Flemish Region	BE	PRESENT	1996	2016	INTRODUCED	Faasse M, Van Moorsel G (2003) The North-American amphipods, Melita nitida Smith, 1873 and Incisocalliope aestuarius (Watling and Maurer, 1973) (Crustacea: Amphipoda: Gammaridea), introduced to the western Scheldt estuary (The Netherlands). Aquatic Ecology 37: 13–22, https://doi.org/10.1023/A:1022120729031	5177825	289244ee-e1c1-49aa-b2d7-d379391ce265
ISO_3166-2:BE-VLG	Flemish Region	BE	PRESENT	1937	2016	INTRODUCED	Collection RBINS	5864277	289244ee-e1c1-49aa-b2d7-d379391ce265
ISO_3166-2:BE-VLG	Flemish Region	BE	PRESENT	1997	2016	INTRODUCED	Messiaen M, Lock K, Gabriels W, Vercauteren T, Wouters K, Boets P, Goethals PLM (2010) Alien macrocrustaceans in freshwater ecosystems in the eastern part of Flanders (Belgium). Belgian Journal of Zoology 140: 30–39	4315705	289244ee-e1c1-49aa-b2d7-d379391ce265
ISO_3166-2:BE-VLG	Flemish Region	BE	PRESENT	1991	2016	INTRODUCED	Messiaen M, Lock K, Gabriels W, Vercauteren T, Wouters K, Boets P, Goethals PLM (2010) Alien macrocrustaceans in freshwater ecosystems in the eastern part of Flanders (Belgium). Belgian Journal of Zoology 140: 30–39	2219863	289244ee-e1c1-49aa-b2d7-d379391ce265
ISO_3166-2:BE-VLG	Flemish Region	BE	PRESENT	2009	2016	INTRODUCED	Boets P, Lock K, Tempelman D, Van Haaren T, Platvoet D, Goethals PLM (2012c) First occurrence of the Ponto-Caspian amphipod Echinogammarus trichiatus (Martynov, 1932) (Crustacea: Gammaridae) in Belgium. BioInvasions Records 1: 115–120, https://doi.org/10.3391/bir.2012.1.2.06	4417131	289244ee-e1c1-49aa-b2d7-d379391ce265
ISO_3166-2:BE-VLG	Flemish Region	BE	PRESENT	1925	2016	INTRODUCED	Wouters K (2002) On the distribution of alien non-marine and estuarine macro-crustaceans in Belgium. Bulletin van het Koninklijk Belgisch Instituut voor Natuurwetenschappen, Biologie 72: 119–129	4315760	289244ee-e1c1-49aa-b2d7-d379391ce265
ISO_3166-2:BE-VLG	Flemish Region	BE	PRESENT	1998	2016	INTRODUCED	Cook EJ, Jahnke M, Kerckhof F, Minchin D, Faasse M, Boos K, Ashton G (2007) European expansion of the introduced amphipod Caprella mutica Schurin, 1935. Aquatic Invasions 2: 411–421, https://doi.org/10.3391/ai.2007.2.4.11	5178057	289244ee-e1c1-49aa-b2d7-d379391ce265
ISO_3166-2:BE-VLG	Flemish Region	BE	PRESENT	1999	2016	INTRODUCED	Boets P, Lock K, Goethals PLM (2011b) Shifts in the gammarid (Amphipoda) fauna of brackish polder waters in Flanders (Belgium). Journal of Crustacean Biology 31: 270–277, https://doi.org/10.1651/10-3357.1	2224970	289244ee-e1c1-49aa-b2d7-d379391ce265
ISO_3166-2:BE-VLG	Flemish Region	BE	PRESENT	1991	2016	INTRODUCED	Van Damme P, Mees J, Maebe S (1992) Voorkomen van het Zuiderzeekrabbetje Rhithropanopeus harrisii (Gould, 1841) in de Westerschelde. De Strandvlo 12(1): 19–21	2227663	289244ee-e1c1-49aa-b2d7-d379391ce265
ISO_3166-2:BE-VLG	Flemish Region	BE	PRESENT	2003	2016	INTRODUCED	Dumoulin E (2004) Snelle areaaluitbreiding van het penseelkrabbetje Hemigrapsus penicillatus (de Haan, 1835) langs de kusten van de Zuidelijke Bocht van de Noordzee, status van haar opmars in de Westerschelde en beschouwingen over de ecologie en het gedrag van de soort. De Strandvlo 24(1): 5-35	4382841	289244ee-e1c1-49aa-b2d7-d379391ce265
ISO_3166-2:BE-VLG	Flemish Region	BE	PRESENT	2006	2016	INTRODUCED	Nuyttens F, Versele G, Loones MA (2006) De aanwezigheid van de penseelkrab Hemigrapsus takanoi en de blaasjeskrab Hemigrapsus sanguineus in NieuwpoortBad. De strandvlo 26: 114–115	2225772	289244ee-e1c1-49aa-b2d7-d379391ce265
ISO_3166-2:BE-VLG	Flemish Region	BE	PRESENT	1933	2016	INTRODUCED	Wouters K (2002) On the distribution of alien non-marine and estuarine macro-crustaceans in Belgium. Bulletin van het Koninklijk Belgisch Instituut voor Natuurwetenschappen, Biologie 72: 119–129	2225776	289244ee-e1c1-49aa-b2d7-d379391ce265
ISO_3166-2:BE-VLG	Flemish Region	BE	PRESENT	1993	2016	INTRODUCED	Van Damme P, Maes J (1993) De Blauwe Zwemkrab Callinectes sapidus Rathbun, 1896 in de Westerschelde (België). De Strandvlo 13(4): 120–121	2225646	289244ee-e1c1-49aa-b2d7-d379391ce265
ISO_3166-2:BE-VLG	Flemish Region	BE	PRESENT	2008	2016	INTRODUCED	Boets P, Lock K, Cammaerts R, Plu D, Goethals PLM (2009) Occurrence of the invasive crayfish Procambarus clarkii (Girard, 1852) in Belgium (Crustacea: Cambaridae). Belgian Journal of Zoology 139: 173–175	2227300	289244ee-e1c1-49aa-b2d7-d379391ce265
ISO_3166-2:BE-VLG	Flemish Region	BE	PRESENT	1977	2016	INTRODUCED	Wouters K (2002) On the distribution of alien non-marine and estuarine macro-crustaceans in Belgium. Bulletin van het Koninklijk Belgisch Instituut voor Natuurwetenschappen, Biologie 72: 119–129	2227000	289244ee-e1c1-49aa-b2d7-d379391ce265
ISO_3166-2:BE-VLG	Flemish Region	BE	PRESENT	1986	2016	INTRODUCED	Gérard P (1986) Les différentes espèces d'écrevisses en Belgique et leur répartition géographique. Station de Recherche Forestière et Hydrobiologique. Travaux serie D 54, 25 p	2226990	289244ee-e1c1-49aa-b2d7-d379391ce265
ISO_3166-2:BE-VLG	Flemish Region	BE	PRESENT	2007	2016	INTRODUCED	van Haaren T, Soors J (2009) Sinelobus stanfordi (Richardson, 1901): a new crustacean invader in Europe. Aquatic Invasions 4: 703–711, https://doi.org/10.3391/ai.2009.4.4.20	7547256	289244ee-e1c1-49aa-b2d7-d379391ce265
ISO_3166-2:BE-VLG	Flemish Region	BE	PRESENT	1980	2018	INTRODUCED	NA	5202793	98940a79-2bf1-46e6-afd6-ba2e85a26f9f
ISO_3166-2:BE-VLG	Flemish Region	BE	PRESENT	1201	2018	INTRODUCED	NA	4286975	98940a79-2bf1-46e6-afd6-ba2e85a26f9f
ISO_3166-2:BE-VLG	Flemish Region	BE	PRESENT	2012	2018	INTRODUCED	NA	4285968	98940a79-2bf1-46e6-afd6-ba2e85a26f9f
ISO_3166-2:BE-VLG	Flemish Region	BE	PRESENT	2001	2018	INTRODUCED	NA	4287131	98940a79-2bf1-46e6-afd6-ba2e85a26f9f
ISO_3166-2:BE-VLG	Flemish Region	BE	PRESENT	1975	2018	INTRODUCED	NA	2362473	98940a79-2bf1-46e6-afd6-ba2e85a26f9f
ISO_3166-2:BE-VLG	Flemish Region	BE	PRESENT	1601	2018	INTRODUCED	NA	2366634	98940a79-2bf1-46e6-afd6-ba2e85a26f9f
ISO_3166-2:BE-VLG	Flemish Region	BE	PRESENT	1984	2018	INTRODUCED	NA	2367742	98940a79-2bf1-46e6-afd6-ba2e85a26f9f
ISO_3166-2:BE-VLG	Flemish Region	BE	PRESENT	1601	2018	INTRODUCED	NA	4286942	98940a79-2bf1-46e6-afd6-ba2e85a26f9f
ISO_3166-2:BE-VLG	Flemish Region	BE	PRESENT	2015	2018	INTRODUCED	NA	2379105	98940a79-2bf1-46e6-afd6-ba2e85a26f9f
ISO_3166-2:BE-VLG	Flemish Region	BE	PRESENT	1890	2018	INTRODUCED	NA	2382155	98940a79-2bf1-46e6-afd6-ba2e85a26f9f
ISO_3166-2:BE-VLG	Flemish Region	BE	PRESENT	1885	2018	INTRODUCED	NA	2394486	98940a79-2bf1-46e6-afd6-ba2e85a26f9f
ISO_3166-2:BE-VLG	Flemish Region	BE	PRESENT	1871	2018	INTRODUCED	NA	2340989	98940a79-2bf1-46e6-afd6-ba2e85a26f9f
ISO_3166-2:BE-VLG	Flemish Region	BE	PRESENT	1884	2018	INTRODUCED	NA	5204019	98940a79-2bf1-46e6-afd6-ba2e85a26f9f
ISO_3166-2:BE-VLG	Flemish Region	BE	PRESENT	2016	2018	INTRODUCED	NA	2367033	98940a79-2bf1-46e6-afd6-ba2e85a26f9f
ISO_3166-2:BE-VLG	Flemish Region	BE	PRESENT	2010	2018	INTRODUCED	NA	2379089	98940a79-2bf1-46e6-afd6-ba2e85a26f9f
ISO_3166-2:BE-VLG	Flemish Region	BE	PRESENT	1884	2018	INTRODUCED	NA	5202520	98940a79-2bf1-46e6-afd6-ba2e85a26f9f
ISO_3166-2:BE-VLG	Flemish Region	BE	PRESENT	1975	2018	INTRODUCED	NA	2362486	98940a79-2bf1-46e6-afd6-ba2e85a26f9f
ISO_3166-2:BE-VLG	Flemish Region	BE	PRESENT	1990	2018	INTRODUCED	NA	4285694	98940a79-2bf1-46e6-afd6-ba2e85a26f9f
ISO_3166-2:BE-VLG	Flemish Region	BE	PRESENT	1992	2018	INTRODUCED	NA	2362868	98940a79-2bf1-46e6-afd6-ba2e85a26f9f
ISO_3166-2:BE-VLG	Flemish Region	BE	PRESENT	1920	2018	INTRODUCED	NA	5203111	98940a79-2bf1-46e6-afd6-ba2e85a26f9f
ISO_3166-2:BE-VLG	Flemish Region	BE	PRESENT	1967	2018	INTRODUCED	NA	2362030	98940a79-2bf1-46e6-afd6-ba2e85a26f9f
ISO_3166-2:BE-VLG	Flemish Region	BE	PRESENT	2e3	2018	INTRODUCED	NA	2402168	98940a79-2bf1-46e6-afd6-ba2e85a26f9f
ISO_3166-2:BE-VLG	Flemish Region	BE	PRESENT	2018	2018	INTRODUCED	NA	7802465	9ff7d317-609b-4c08-bd86-3bc404b77c42
ISO_3166-2:BE-VLG	Flemish Region	BE	PRESENT	Inf	-Inf	INTRODUCED	NA	3033077	9ff7d317-609b-4c08-bd86-3bc404b77c42
ISO_3166-2:BE-VLG	Flemish Region	BE	PRESENT	2006	2006	INTRODUCED	NA	5914287	9ff7d317-609b-4c08-bd86-3bc404b77c42
ISO_3166-2:BE-VLG	Flemish Region	BE	PRESENT	2004	2004	INTRODUCED	NA	3172622	9ff7d317-609b-4c08-bd86-3bc404b77c42
ISO_3166-2:BE-VLG	Flemish Region	BE	PRESENT	Inf	-Inf	INTRODUCED	NA	2889934	9ff7d317-609b-4c08-bd86-3bc404b77c42
ISO_3166-2:BE-VLG	Flemish Region	BE	PRESENT	1974	1981	INTRODUCED	NA	5646410	9ff7d317-609b-4c08-bd86-3bc404b77c42
ISO_3166-2:BE-VLG	Flemish Region	BE	PRESENT	1893	1893	INTRODUCED	NA	7397079	9ff7d317-609b-4c08-bd86-3bc404b77c42
ISO_3166-2:BE-VLG	Flemish Region	BE	PRESENT	1860	1863	INTRODUCED	NA	5646136	9ff7d317-609b-4c08-bd86-3bc404b77c42
ISO_3166-2:BE-VLG	Flemish Region	BE	PRESENT	2014	2014	INTRODUCED	NA	5569367	9ff7d317-609b-4c08-bd86-3bc404b77c42
ISO_3166-2:BE-VLG	Flemish Region	BE	PRESENT	Inf	-Inf	INTRODUCED	NA	3872463	9ff7d317-609b-4c08-bd86-3bc404b77c42
ISO_3166-2:BE-VLG	Flemish Region	BE	PRESENT	1993	2018	INTRODUCED	NA	3171888	9ff7d317-609b-4c08-bd86-3bc404b77c42
ISO_3166-2:BE	Belgium	BE	PRESENT	2009	2009	INTRODUCED	NA	2684984	9ff7d317-609b-4c08-bd86-3bc404b77c42
ISO_3166-2:BE-VLG	Flemish Region	BE	PRESENT	2014	2017	INTRODUCED	NA	8060423	9ff7d317-609b-4c08-bd86-3bc404b77c42
ISO_3166-2:BE-VLG	Flemish Region	BE	PRESENT	Inf	-Inf	INTRODUCED	NA	3190382	9ff7d317-609b-4c08-bd86-3bc404b77c42
ISO_3166-2:BE-VLG	Flemish Region	BE	PRESENT	Inf	-Inf	INTRODUCED	NA	7740617	9ff7d317-609b-4c08-bd86-3bc404b77c42
